{
  "schema_version": 1,
  "id": "org.republic-observatory.wrsr-1.1.1.9",
  "version": "1.1.0",
  "parser_engine_api_version": "1.0.0",
  "author": "Republic Observatory contributors",
  "description": "Reviewed compatibility mappings preserving the parser behaviour verified for Workers & Resources: Soviet Republic 1.1.1.9.",
  "targets": {
    "game_versions": ["1.1.1.9"],
    "build_ids": [],
    "stats_formats": [1]
  },
  "content_hash": "44bcec2f9abba9d2559fd9c283220238f65000e1ef14f010ebebf3dff45053e8",
  "mappings": {
    "catalogue_scopes": [],
    "archive_entries": [{ "slot": "stats", "aliases": ["stats.ini"] }],
    "stats_markers": [
      {
        "slot": "format",
        "aliases": ["$STATS_FORMAT"],
        "accepted_values": [1]
      },
      { "slot": "history_record", "aliases": ["$STAT_RECORD"] },
      { "slot": "current_state", "aliases": ["$STAT_CURRENT"] },
      { "slot": "city", "aliases": ["$STAT_CITY"] },
      { "slot": "date_year", "aliases": ["$DATE_YEAR"] },
      { "slot": "date_day", "aliases": ["$DATE_DAY"] }
    ],
    "stats_fields": [
      {
        "host_slot": "core.citizens.electronics.none",
        "aliases": ["$Citizens_EletronicNone"],
        "contexts": ["history", "republic"]
      },
      {
        "host_slot": "core.citizens.electronics.radio",
        "aliases": ["$Citizens_EletrinicRadio"],
        "contexts": ["history", "republic"]
      },
      {
        "host_slot": "core.citizens.electronics.television",
        "aliases": ["$Citizens_EletronicTV"],
        "contexts": ["history", "republic"]
      },
      {
        "host_slot": "core.citizens.electronics.computer",
        "aliases": ["$Citizens_EletronicComputer"],
        "contexts": ["history", "republic"]
      },
      {
        "host_slot": "source.stats.citizens.born",
        "aliases": ["$Citizens_Born"],
        "contexts": ["republic", "city"]
      },
      {
        "host_slot": "source.stats.citizens.dead",
        "aliases": ["$Citizens_Dead"],
        "contexts": ["republic", "city"]
      },
      {
        "host_slot": "source.stats.citizens.escaped",
        "aliases": ["$Citizens_Escaped"],
        "contexts": ["republic", "city"]
      },
      {
        "host_slot": "source.stats.citizens.immigrant_soviet",
        "aliases": ["$Citizens_ImigrantSoviet"],
        "contexts": ["republic", "city"]
      },
      {
        "host_slot": "source.stats.citizens.immigrant_africa",
        "aliases": ["$Citizens_ImigrantAfrica"],
        "contexts": ["republic", "city"]
      },
      {
        "host_slot": "source.stats.citizens.small_children",
        "aliases": ["$Citizens_SmallChilds"],
        "contexts": ["republic"]
      },
      {
        "host_slot": "source.stats.citizens.medium_children",
        "aliases": ["$Citizens_MediumChilds"],
        "contexts": ["republic"]
      },
      {
        "host_slot": "source.stats.citizens.adults_parent",
        "aliases": ["$Citizens_AdultsParent"],
        "contexts": ["republic"]
      },
      {
        "host_slot": "source.stats.citizens.adults",
        "aliases": ["$Citizens_Adults"],
        "contexts": ["republic"]
      },
      {
        "host_slot": "source.stats.citizens.unemployed",
        "aliases": ["$Citizens_Unemployed"],
        "contexts": ["republic"]
      },
      {
        "host_slot": "source.stats.citizens.no_education",
        "aliases": ["$Citizens_NoEducation"],
        "contexts": ["republic"]
      },
      {
        "host_slot": "source.stats.citizens.basic_education",
        "aliases": ["$Citizens_BasicEducationNum"],
        "contexts": ["republic"]
      },
      {
        "host_slot": "source.stats.citizens.higher_education",
        "aliases": ["$Citizens_HighEducationNum"],
        "contexts": ["republic"]
      },
      {
        "host_slot": "source.stats.citizens.car_owners",
        "aliases": ["$Citizens_CarOwners"],
        "contexts": ["republic"]
      },
      {
        "host_slot": "market.price.purchase.rub",
        "aliases": ["$Economy_PurchaseCostRUB"],
        "contexts": ["history", "republic", "city"]
      },
      {
        "host_slot": "market.price.purchase.usd",
        "aliases": ["$Economy_PurchaseCostUSD"],
        "contexts": ["history", "republic", "city"]
      },
      {
        "host_slot": "market.price.sell.rub",
        "aliases": ["$Economy_SellCostRUB"],
        "contexts": ["history", "republic", "city"]
      },
      {
        "host_slot": "market.price.sell.usd",
        "aliases": ["$Economy_SellCostUSD"],
        "contexts": ["history", "republic", "city"]
      },
      {
        "host_slot": "market.price.base.rub",
        "aliases": ["$Economy_BaseRUB"],
        "contexts": ["history", "republic", "city"]
      },
      {
        "host_slot": "market.price.base.usd",
        "aliases": ["$Economy_BaseUSD"],
        "contexts": ["history", "republic", "city"]
      },
      {
        "host_slot": "market.trade.import.standard.rub",
        "aliases": ["$Resources_ImportRUB"],
        "contexts": ["history", "republic", "city"]
      },
      {
        "host_slot": "market.trade.import.standard.usd",
        "aliases": ["$Resources_ImportUSD"],
        "contexts": ["history", "republic", "city"]
      },
      {
        "host_slot": "market.trade.export.standard.rub",
        "aliases": ["$Resources_ExportRUB"],
        "contexts": ["history", "republic", "city"]
      },
      {
        "host_slot": "market.trade.export.standard.usd",
        "aliases": ["$Resources_ExportUSD"],
        "contexts": ["history", "republic", "city"]
      },
      {
        "host_slot": "market.trade.import.international.rub",
        "aliases": ["$Resources_ImportInternationalRUB"],
        "contexts": ["history", "republic", "city"]
      },
      {
        "host_slot": "market.trade.import.international.usd",
        "aliases": ["$Resources_ImportInternationalUSD"],
        "contexts": ["history", "republic", "city"]
      },
      {
        "host_slot": "market.trade.export.international.rub",
        "aliases": ["$Resources_ExportInternationalRUB"],
        "contexts": ["history", "republic", "city"]
      },
      {
        "host_slot": "market.trade.export.international.usd",
        "aliases": ["$Resources_ExportInternationalUSD"],
        "contexts": ["history", "republic", "city"]
      },
      {
        "host_slot": "market.cost.delivery.rub",
        "aliases": ["$Economy_DeliveryCostRUB"],
        "contexts": ["history", "republic", "city"]
      },
      {
        "host_slot": "market.cost.delivery.usd",
        "aliases": ["$Economy_DeliveryCostUSD"],
        "contexts": ["history", "republic", "city"]
      },
      {
        "host_slot": "market.cost.labour.rub",
        "aliases": ["$Economy_WorkdayCostRUB"],
        "contexts": ["history", "republic", "city"]
      },
      {
        "host_slot": "market.cost.labour.usd",
        "aliases": ["$Economy_WorkdayCostUSD"],
        "contexts": ["history", "republic", "city"]
      },
      {
        "host_slot": "market.cost.immigrant.rub",
        "aliases": ["$Economy_ImmigrantCostRUB"],
        "contexts": ["history", "republic", "city"]
      },
      {
        "host_slot": "market.cost.immigrant.usd",
        "aliases": ["$Economy_ImmigrantCostUSD"],
        "contexts": ["history", "republic", "city"]
      },
      {
        "host_slot": "market.tourism.visitors",
        "aliases": ["$Tourism_Tourists"],
        "contexts": ["history", "republic", "city"]
      },
      {
        "host_slot": "market.tourism.hotel_nights",
        "aliases": ["$Tourism_HotelNights"],
        "contexts": ["history", "republic", "city"]
      },
      {
        "host_slot": "market.tourism.spending.rub",
        "aliases": ["$Tourism_SpendRUB"],
        "contexts": ["history", "republic", "city"]
      },
      {
        "host_slot": "market.tourism.spending.usd",
        "aliases": ["$Tourism_SpendUSD"],
        "contexts": ["history", "republic", "city"]
      },
      {
        "host_slot": "market.loan.balance.rub",
        "aliases": ["$Loan_BalanceRUB"],
        "contexts": ["history", "republic", "city"]
      },
      {
        "host_slot": "market.loan.balance.usd",
        "aliases": ["$Loan_BalanceUSD"],
        "contexts": ["history", "republic", "city"]
      },
      {
        "host_slot": "market.loan.interest.rub",
        "aliases": ["$Loan_InterestRUB"],
        "contexts": ["history", "republic", "city"]
      },
      {
        "host_slot": "market.loan.interest.usd",
        "aliases": ["$Loan_InterestUSD"],
        "contexts": ["history", "republic", "city"]
      },
      {
        "host_slot": "market.vehicle.import.rub",
        "aliases": ["$Vehicles_ImportRUB"],
        "contexts": ["history", "republic", "city"]
      },
      {
        "host_slot": "market.vehicle.import.usd",
        "aliases": ["$Vehicles_ImportUSD"],
        "contexts": ["history", "republic", "city"]
      },
      {
        "host_slot": "market.vehicle.export.rub",
        "aliases": ["$Vehicles_ExportRUB"],
        "contexts": ["history", "republic", "city"]
      },
      {
        "host_slot": "market.vehicle.export.usd",
        "aliases": ["$Vehicles_ExportUSD"],
        "contexts": ["history", "republic", "city"]
      }
    ],
    "definition_directives": [
      {
        "id": "core.building.construction_phase",
        "operation": "building.construction_phase",
        "matches": [{ "kind": "exact", "value": "$COST_WORK" }]
      },
      {
        "id": "core.definition.display_name",
        "operation": "definition.display_name",
        "matches": [{ "kind": "exact", "value": "$NAME_STR" }]
      },
      {
        "id": "core.definition.name_token",
        "operation": "definition.name_token",
        "matches": [{ "kind": "exact", "value": "$NAME" }]
      },
      {
        "id": "core.building.style",
        "operation": "building.style",